TBM,8,,6,,,,,8,,,7,,,,8,Rajat Mathur's course had most impact on me,2,4,"Quality of depthness across courses is good, but due to which density is reduced by a lot. Most of the course's complete content can be put on 10 A4 pages. To summarise, Number of concepts taught is very less for most courses, but whatever that is taught is taught with depthness.",2,Not opt in the content creation challenge,1,"Building a startup has become synonymous to building a brand. As this is true for outclass's outlook, same reflects in current VC scene and TV shows like shark tank, where revenue is priotorized. But I do believe building something meaningful is more important. Because I believe, to keep the MU spirit, first unicorn shouldn't be MU but should come from MU. Which could only happen if we think more from a Y Combinator incubator POV and less from Fellowship organisation POV.",0,"No, I am afraid to say other than emotional support, I don't think they provided any support particular to the domain I am targetting.",0,"Just how we evaluvate academics, we should also evaluvate students from different domains in different competitions like a setting (similar to hackathons) and have a leaderboard for it. That is the only way to make prep competitive, which is absolute necessity. Need to be very careful how these evaluvations are gamified and ranked and what material is used because career prep's quality of material should improve.",5,Diversity of roles floating every month are as important as having good brands,No comments.,Not answered,3,7,"The party at brickspaze, because that was probably the only activity I attended.",6,Not answered,6,Not answered,5,5,Not answered,7,Not answered,4,"Cannot singleout any reason, and this might actually be one more reason","Letting students choose how they attend lectures, a shift could directly be seen between students and what they talk about. They don't just talk about assignments now, talk about lot of other things.","I think a technical shift is needed from choosing the best immediate outcome to actually providing value. If MU is a gym, the job of MU as an organisation is only to provide resources, that is it. Which shouldn't be the case because what happens when someone new enters the gym, that person wastes time. A guy with best trainer and okayish gym equipments will always outperform guy with no trainer and best gym equipments. In Learn by doing - doing shouldn't be ""go get the outcome"", but doing should be well defined as to once done outcome is accompolished."
TBM,5,,6,,,,,6,3,5,,,,5,8,Dr. Rajat Mathur for Leadership lab,5,5,To keep it rigours like term 1. From term 2 onwards academics didn’t seem so challenging,6,"No, not at all. It should have been more exciting and engaging",3,Keep it more engaging and challenging.,4,I understood on what to prepare for but not sure how to,4,Nothing specific,2,To bring more D2C and growth focused role for Marketing,Market Research by Dr. Bhupesh,No,2,5,Not anything specific.,3,No,6,No,6,7,No,5,No,5,"I had high expectations till term 1, post that the curriculum was designed in a way it brought down the energy. According to me it was supposed to be rigours so students can keep challenging themselves",Market research and marketing practicum,Whatever I have mentioned earlier about keeping it challenging
TBM,7,8,8,,,,6,7,,,9,,,,8,Shravan Tickoo sir who taught us product analytics was great and leadership class by Rajat sir was also very good. had so many learnings from both of these.,7,6,we can improve either the depth or breadth of concepts because we were covering concepts but they were either too vague in concept or not explored where it was needed.,7,"I don't have it, haven't taken up the challenge.",7,change is definitely needed in outclass perspective. no such thing as a learning in the outclass sessions.,6,We can do better in career prep processes. Applications to jobs and the shortlist procedure should be improved so much. we are not sure how the team reaches out to the companies. Using WhatsApp as the main medium for communication is also not great.,6,"For domain practicums apart from the sessions, we can add some more sessions or focused preparation for students interested in a specific industry. Although industry readiness sessions help in the process, this doesn't provide us any thing objective to start working on.",6,"we need better follow up mechanisms, shortlisting procedures are also not being clear, we don't know how placements process is going on.","Shravan Tickoo sessions were great, had direct impactful learnings to product domain from him.",no,3,5,"In class sessions were great especially from Bhupesh sir, Shravan Tickoo sir and leadership lab from Rajat sir.",5,there's no such concrete thing as student affairs in MU.,6,platform is not that great.,9,9,the only thing I'm happy about in career prep is Mentorunion. Mentors were great at addressing our concerns and it is very helpful in preparing for interviews.,8,"latency issues, sometimes calendar issues can be fixed.",6,"Academics is the only thing a bit better in MU. All the other things spanning career prep, Placements , outclass , student affairs each and every thing should take a giant leap to hold the brand of MU. As a cohort, we are feeling so bad about everyday things also. Expectation mismatch is the single biggest reason for the score.",Academics is the thing working for MU currently. we can try to uphold the quality of it and improve all other fronts going forward.,"I would talk to students at least once per term or at least once in 3-4 months. there is a lot of information asymmetry and lot of info is not reaching Pratham only. each member in any team also have different ways of operation, there is no concrete process setup in place for anything especially placements, career prep and outclass. Outclass should be improved a lot much to consider it something meaningful."
TBM,7,,,7,7,3,6,7,5,,,5,,,9,Leadership lab mr mathur had most impact,7,6,There are few subjects that can be turned into 5 hour masterclass,1,did not participate in it so cant tell,1,Change the whole model and stop promoting d2c businesses only for your own KPI`s,5,"Yes , the career prep questions are good prep",5,nothing,4,none,Mr. mathur leadership lab,There used to be plenty of cxo`s coming to campus in term one now the number has dropped drastically,1,4,Unmute was alright but the scale at which it happened was concerning since unmute aims to be the biggest student fest in india,2,no,5,no,6,6,no,3,no,6,The core academics team is super helpful and well qualified also the student circle is great,ndsnun iufweoew ynynoygweo,The outclass activities have to be completely restructured if MU wants to be the top B school it can not be promoting just vague d2c brands which are going to tremble in few months
TBM,8,,9,8,8,10,,8,,,8,,,,8,Ashank Bhandari- product management 102,7,7,No comments,7,Yes it did. It was very informative,7,No comments,7,Yes they were helpful but could be more specific un giving out information.,7,No comments,6,"There have been very few campus drives and most of the roles for PM domain have been lateral, we would want more campus drives for this domain",Dr. Rajat Mathur. It was quite interesting having that view of the corporate worls,They can be more informative,7,6,The Sports tournaments and the MVP experience has been great,7,No comments,7,No comments,8,8,Rishabh Gupta has been a great help in career prep,7,No,6,It has been very monotonous.,My prep has been great and I would like to keep up,I would drive more focus on the career prep
TBM,10,,8,8,8,9,,9,7,7,,,,,10,Rajat mathur- excellent class control and content,8,7,Faculty and course content was really relevant and improved substantially as compared to last term,7,Did not opt for the content creation challenge,7,Reassured me of my idea and gave me confidence to pitch in front of investors,6,Yes interview transcripts and cep sessions proved to be really helpful,7,Number of HR domain classes could be increased- a lot of topics were just skimmed owing to limited time (3 sessions),7,Timely updates on companies and release of shortlists atleast 3-4 days prior to the interview would help us prepare better,"Decision making, macro economics and market research courses especially stood out for me owing to indistry relevance and strong class control",Would like to attend more CXO sessions from Hr domain especially,4,8,Outclass provided great confidence and reassured me of my business idea,7,——————,7,1. The global search does not work in most cases 2. Evaluation criteria for some of the courses is wrongly mentioned,7,7,——————-,8,Global search does not work,7,Faculty and course relevance,Case-based discussions made classes engaging and helped connect theory to real-world decision making,Offer more role based electives
TBM,9,7,8,3,9,,10,10,,,,8,10,,9,"Pranav Dedhia, Dr. Bhupesh and Dr. Garima has the most impact on me",9,9,"1. The ODCs are great opportunities, but I feel like the time allocated to them is not sufficeient. If they were introduced at the start of the courses and we could keep applying what we learn in courses as they progress to solve the ODC the outcomes would be more fleshed out 2. One very important thing I want to point out is the leave policy, it has personally hurt my grades and even mental well being to a great extent. I have chronic astma and got into a severe accident. My leave for astmatic reason was not approved and caused a grade drop. I studied a lot to keep my grades up to get above an A in everything and getting penalised for being unwell seems extremely unfair. I shared the medical reports and did not hear back from the team for a long time, and then they denied the leave saying that the grades were locked, which again happened when term 3 is ending for term 2.",10,"NA, did not sign up for content creation challenge",6,The Outclass seem to be repetative. We had similar classes for VIP and Dropshipping and MVP seems to be going in a similar direction,9,"It has, there can be improvement made on mentor feedback but that is a personal greivance as my mentor did not fill in my consulting mock review and I have been penalised for it",8,Better updates on lateral posts and maybe review for why certain profiles are not being shortlisted and how that can be changed even after getting a relatively high resume score,6,NO PARTICULAR FEEDBACK,There were no standouts for me unfortunately,"Would love to have more opportunites for the roundtables, they fill up quickly and understandably so",5,8,The classes not being shuffuled is helping develop better relations with the peers,9,No improvements as such,9,A status update on the companies that we have applied for - especially rejections to be visible so we don't keep waiting to hear back,8,9,No such improvements,8,"The ""update timezone"" shows up evertime. it's an annoying glitch",10,Great options for electives and core faculty,The visiting faculty was great for the term and the courses were aligned to individual interests,"I may be biased but I will look into the leave policy, it seems redundant for a college for Masters' Union trying to reinvent higher education. Penalising students for not being in a certain number of classes is redundant. I would also open the cloud kitchen opportunity for PGP TBM students And lastly I would audit professors coming to teach so I can vet the quality of educators the students will recieve"
TBM,8,,8,8,8,,,9,5,6,,,,,7,Market Research by Dr. Bhupesh,6,7,Timely tests/assignments instead of piling everything towards the end would be better.,5,Did not opt it for this,5,Schedule sessions earlier in the day,3,Career prep feels like a waste of time and extremely forced. Most modules are basically AI submissions just for the sake of it. It should be voluntary to attend these sessions because there is little value in these activities.,3,Please make these sessions voluntary to attend. Most of the activities are not value additional to one. For anyone who wants to work on anything specific can reach out for help but let the rest be. These behavioural sessions along with the ANM are just time consuming with no real outcome.,7,Would like to see more legacy companies and transparency of whether a role is lateral or campus drive.,Cannot recall any speaker names,Cannot think of anything,6,5,The sports day was fun.,7,Cannot think of anything,7,Cannot think of anything,6,7,Cannot think of anything,8,Cannot think of anything,6,The only faculty to really attend lectures of and interact with that makes MU worth it is Dr. Bhupesh,Scheduling was better,"-Reduce the number of incumbents to ensure quality of batch or any competitive exam to gatekeep -stricter action for students found cheating using their phones. The dean's list basically a list of people who are best at cheating. Quite obvious when you converse with most of them -Scout for legacy companies to start visiting for placements or ensure specific shortlisted profiles are pitched to these cos -Make attendance voluntary and remove the 80% criteria or at least the grade drops Ultimately, we all want Masters' Union to be the top B school in India and globally but the quality of students is what will get us there so a better batch would definitely help"
TBM,10,,10,,,,10,10,7,,10,,10,,10,"Market research , Dr Bhupesh",10,8,None,3,Not applicable to me as I did not participate,4,The sessions were insightful however it lacked clarity in how to build mvp in proper manner,7,Yes they have made me more confident in terms of preparing for placement s,6,The interaction with career prep is still less. The resumes do not seem ATS approved,8,The campus openings still seem less and lateral opportunities have very low conversion rate,"Market research, Dr Bhupesh",Did not get the chance to meet the cxo team,10,9,Parliamentary visit and outclass visits to various places,8,Did not have much interaction with the student affairs team,6,There are instances where career coach sometimes doesn’t work,10,10,None. I have been a frequent user of mentorunion and it has been working smoothly,9,"None, the application has been working properly so far",8,Improvements from the past term,Learnings from the mentors and professors in this term,Get more campus opportunities rather than lateral ones for jobs
TBM,8,,9,,,,,9,,5,10,,,7,9,I loved the way Shravan Tickoo taught us Product Analytics. Loved the subject and loved the concept he teach us.,8,7,Early results and the answer key for each exam will help us to learn from our mistake (It will make easier for us to refect on those exams). Term 2 results are still not out and its Term 4 Going on.,6,"No, I didn't participate",6,Not answered,5,We can have some mocks of case type interview and technical mock interviews which will help.,5,Please provide us more guidance for each domain. Like we can have some 1-2 classes/ sessions for prep on each domain. As most of the practicum ended in term 1 and 2 for me.,2,Please keep the count of lateral and on campus drive seperate and the numbers on the career prep are deceiving and also there are not any shortlist going on for more that 90% of the companies.,"Shravan Tickoo, Bhupesh Sir",Not answered,3,6,Shravan Tickoo Classes,5,Not answered,8,Not answered,8,8,More mentors will be good,8,Not answered,6,I give it because Academics and the outclass is good but the career services team is not bringing in right set of companies and also they are bringing in soo much of lateral role which are just showing up in numbers but no shortlist come after we apply to them.,I learned a lot in Market research and the product Analytics calsses.,I would analyze all the jobs which are on the portal and see what is the issue and why so many bogus jobs are there with no shortlist. I will ask the career service team to bring in more good companies with good opportunities and with give them more resources to help bring in more opportunities and make the C6 placements best in the history of any MBA college.
TBM,8,,9,,,10,,10,7,7,8,,,,10,"Ashank Bhandari, Vipin Sir, Bhupesh Sir, Rajat Mathur",8,8,Not answered,5,Didn't Opt for Creator Challenge,5,Not answered,4,We are not getting on campus roles which makes it very difficult to choose our preparation strategy. Off campus roles we hardly get shortlists,4,Not answered,4,Kindly bring on campus companies for us,Didn't attend lot of sessions,Not answered,2,6,The feedbacks were transparently listened,7,Not answered,7,Not answered,9,9,Not answered,9,Not answered,7,The placements are not happening as per our expectations,Some really good masters,I would just encourage companies to consider our students for the roles and come on campus for hiring
TBM,9,,7,6,6,7,,9,6,0,,,,,5,"Market research, macro, prod man",8,7,Category management was pretty bad- couldve been a 2 hour masterclass. 10 lectures felt completely irrelevant- everything post lecture 6/7 was repeated,6,Not opted for the content creation challenge,3,Not answered,0,"No- not at all. Seems extremely generic and basic for all. Would help much more if it was personalised and not mandatory and should be done basis everyones capabilities. For me, the behavioural stuff just seems irrelevant because Ive done this at length pre mba and for mba interviews as well. The ANM mentors are too immature and dont provide any real value- my CV is better than theirs, how can I go to them for help with my CV and prep?",0,Not answered,4,"There are no legacy companies coming in and even the lateral job postings are not being converted. Ive been unable to apply to any more jobs because I only want to go to a legacy company and everytime theres a lateral posting and I apply for it- first theres no response and then its closed saying its been filled in b y them off campus. So when career services sends emails with weekly stats mentioning how theyve created so many opportunities, it just seems SO FAKE. youre creating opportunities in companies that might not even exist in another 3-4 months and when youre posting Linkedin jobs- nothings getting converted. so Im not relying on the placement team AT ALL, and doin g my own outreach, which is quite disappointing because we boast about the placement team being run like a business vertical.",--------------------,NA,0,8,Nothing- I'm not participative in student activities.,7,Not answered,6,Not answered,7,7,Not answered,7,Not answered,6,The score increases because of the core courses liek macro and MR. B2B and prod man as electives were also really good. But career services andx placement process drags it down completely because its extremely scary- I feel like i have no prospectives from college when it comes to this.,"Acads! (Except category mgt- the teacher was extremely rude and arrogant) and also scheduling was good mostly BUT the last week got really hectic because everything was concentrated into tnhat week, including classes. Couldve been better spread out.",PLACEMENT!! legacy companies we have so many cxo sessions and masterclasses- we can possibly engage them for campus placements???
TBM,10,6,10,,,,,6,9,,9,,,,10,"Shravan Tickoo - his insights about different products and his lectures were pretty amazing. Vipin Sreekumar - Hands down, one of the best faculties I have had till date.",8,6,"As much as attendance policy is one of the most important aspects of our academics, it should not be that one factor that decides what grades we get. I have genuinely done well in my academics and have worked extremely hard towards my VIP. Sometimes, this attendance aspect hinders with our own capabilities and workflow most of the times. On the other hand, while I understand that attendance is an important factor, but it should not carrry as much weightage as it does. And since it does, it should be fair to everyone. There are multiple students in my own friend circle who submitted fake medical certificates of more than 10 days and have still gotten multiple leeways. There are people who mark their attendance and leave classrooms multiple times and still somehow get attendance. Proxies are still happening, and then students like us, who are working hard towards building their VIPs, or genuinely have health issues are suffering because we don't get enough leeways for same. One more thing, students get attendance leeways for placements, and other things related to their jobs. Why isn't there such a thing for people building their VIPs, or the who've opted out for their VIPs. 20% leeway is definitely fair. I agree. But people who've opted out do not get this. We're all taking enough risks by opting out from placements and working on VIPs full time. Shouldn't there be a policy where we get leeways for our product launches, trials, event promotions etc for the ones seriously building their VIPs, primarily the ones who have opted out?",8,Not really. I didn't work on it,7,"Not really. Personally, Saksham has been extremely helpful to me. Infact, he is going beyond his way to help us out.",1,Not sitting for placements yet,5,"not sitting for placements, not sure",5,no,"I loved the sessions given by Dr. Vipin and Prof Shravan. They were extremely insightful, kept all of us on our toes while answering and helped in applying the sessions to real world examples. Apart from that, Macroeconomics - hands down - the best. I hate the subject, but Dr. Garima made it seem so effortless.",Not sure rn.,6,6,Pre-seed VIP Demo Day - WONDERFUL EXPERIENCE. Would have been better if we had some external investors/mentors as well.,9,"I am a part of one of the clubs. Turn around time for executing certain events, can that be any faster? Too many approvals.",1,didn't use it. Have opted out of placements,2,9,"not really. Because, I didn't use it much.",8,"Incompleted assignments, whether its term 2/3/4 - can they all show in the upcoming tab? To check out incomplete assignments of the previous term, I have to go to the assignments tab of the previous term. Also, makes us forget certain assignments because we can't see them in real time.",7,"Too much ranting happened. Issues were addressed, but not in the right manner. There was too much ranting about not attending classes in sections. We get it, we're probably not the best batch at Masters Union. But we are here now. Fortunately/unfortunately, this is what we have to deal with. Instead of pulling our confidence down by telling us thousands of times that we're not a great batch, can you help us lift our confidence up? Moreover, we're already feeling extremely uncertain about our career trajectories right now, instead of bashing us for every single thing we have done wrong, can you be appreciative? This is the place to make mistakes, then when we actually make mistakes, we get bashed. We should, technically. But term 3 was too much. At this point, I am scared to talk to the acad ops team, certain professors to ask for feedbacks or take my problems to them. Because I am a little scared that I will get bashed and the problem would still not be solved.","Investor feedbacks. And a lot of them. Instead of just investors, can we also have founders coming in? Because not all our businesses are VC-fundable businesses. Some of us are just building, trying to get our hands dirty at whatever we can to succeed. Mentors are what we genuinely need. And while Saksham is a great mentor, it would be great to have a few more come in the campus. I am only focused on VIP right now, so I am not worried much about acads.","Interact with my students. We genuinely want face -time with him, considering he is established and his appreciation might mean the world to us. Especially on our businesses. But he doesn't come to campus that often, atleast not to interact with us. We have heard stories from our seniors that he used to hang out w them in their hostels, give honest feedbacks etc. Don't we deserve this too? If yes, this is exactly what I would fix if I was on his chair. Every single one of us wants to talk to him, and we have not had that opportunity. We know he is busy, but lately, it feels like we are just the money machine for MU and his priorities are Tetr and probably UG."
TBM,10,,10,10,10,,,10,10,9,,10,,,10,"Bhupesh Sir, Rajat Mathur, Rajan Bhalla",10,10,Term 3 was very well paced and I liked the overall learnings,9,Did not opt for the content creators challenge,9,Not answered,10,I liked the overall learnings,10,Not answered,7,RMZ interview experience was a mess,Rajan Bhalla - Real industry insights with great examples Rajat Mathur - Great Detox + Learning Bhupesh - All of the above,"Hardly had any CXO sessions in terms 3, all were nice",10,10,"Everything was well paced, great sessions with Dr. Gopika and Mentors Union is an amazing platform to use",9,Not answered,10,Not answered,10,10,Not answered,10,Not answered,10,Mentor Union was the most useful tool for me in Terms 3,"Honestly, I can't think of anything to be better.",I believe he is doing a damn good job and continue to do so
