TBM,7,,7,,,,,7,,,,,,,10,Rajat Mathur's sessions were most impactful,7,7,Not answered,7,Did not opt for this challenge,5,Not answered,4,"There is no prep as such provided by career prep team. In terms of finance roles, we have investment/ M&A specific roles.. and we are doing VC CEP. Whenever interviews are lined up... those last mile prep does not help much. Only self preparation is helpful",4,Not answered,4,There are very few good roles that have onboard. Roles like key account executive and relationship manager in the banks should not be even offered to us. These are not the kind of roles mba grads should take up,no session stood out for me,Not answered,5,7,One day challenges and daily activities in leadership lab class,6,Not answered,4,"Dashboard can be improved - the entire platform is very basic.. seems like the tech team does not put in much effort to make student/ user life easy. Sometimes filter doesn't work, sometimes jobs are not visible",3,2,"Firstly, it is very difficult to locate a right mentor for yourself (example - no one with experience in REITs/ real estate). Secondly, even if we try to locate one, mentors just keep on cancelling the calls last minute",7,Not answered,7,"I personally was involved in a full time internship for most part of term 3, so my score is based on my experience with whatever time I was able to attend classes and be there in campus",giving leverage of attending the classes with other sections and getting attendance for the same if we are not able to attend our own scheduled session,"Find better job opportunities for students and better here I mean - good roles and good pay. Currently the roles which are coming on board are not at all in tandem with the skill sets we have. How - networking, through his network and interact more with students"
TBM,9,,8,,,,,9,,8,7,,,,9,"Shravan tickoo: was a good teacher but doesn't respond the day he left MU. most likely he just wanted to sell his course and leave. Sahil Puri: A very cocky guy but a lot of knowledge. responds to queries even after he left MU. Ashank: I've heard many good things about him, couldn't get his course so wanted to take the session recordings but he considered himself a very big gun from ISB and didn't share any of his lectures. IDK what's wrong with this shit. Profs are not GODS. Ridiculous",6,6,"Please make the Profs share recordings and the slides and materials. IDC i have given 30L for this, give me course materials for courses I couldn't get beacuse I got outbidded by someone. Profs are not GODS. Get the them in order, India has a vast pool of good faculties, if they are arrogant like this fire them.",2,Didnt opt for this challenge,0,Just please stop with the OUTCLASS this is a joke,3,Absolutely not and most of the people at Career prep are dumb,3,Please be more transparent with all the prep activities,4,Very bad in transparency and the job application portal is a horrible mess,No good session this term and I didn'nt even feel like attending any session.,nothing really they are doing an okay job,6,5,INdoor club competitons,7,Anand you should appear in the public more. People like you and want to see you,1,"Everything is broken, just leave it. make it real time",2,3,Not answered,5,Not answered,4,I am still unable to get a job but atleast I worked hard this term to make my MR project good,more math heavy classes,"get rid of the outclass team, they are a bunch of buffoons and could have so much better people in their"
TBM,7,,7,7,7,9,,10,,6,,9,,9,7,Market Research and Ashank Sir for Product Management 102,7,6,There were so many overlaps and it was very difficult to manage.,6,Not opted for this challenge,6,"we are working on our VIP idea, but still dont know where we can improve",6,"Yes, updating all the things and the guidance did help a lot. less of lateral openings and more of on campus jobs",6,"i was able to get a lot of help with the prep, still looking forward on how to get shortlisting.",7,"getting the responses fast but not able to go ahead on the job profiles needed, figuring out",Ashrank sir's sessions were very helpful for my domain product. Also Bhupesh Sir's MR lectures,"no, there are no more issues as it is not compulsory except for domain",5,6,working and learning on VIP and some inclass courses,6,no there are no issues,8,good visibility but still i am not eligible for some domain jobs due to work ex,8,8,this is a great platform for guidance,7,"for assignments, as soon as the term changes, last term's assignments are not visible on the front page even if its submission is due. If this can change it would be great",6,learnings of inclass and working on outclass,VIP progress and inclass learnings,more on-campus jobs and VIP guidance
TBM,10,,10,10,10,10,,7,8,10,,,,,10,Rajat Mathur - Leadership Lab,8,9,"Overall, things were good. The only area where we felt we could have done better was Market Research. As a class, we were often overthinking whether we were getting things right, which created unnecessary pressure. It wasn’t a delivery issue as much as us needing more time to settle into the concepts and apply them with confidence. Once we did, the learning really clicked. Bhupesh sir’s sessions on Consumer Behaviour and Building Marketing Strategies were especially impactful and helped bring clarity and structure to our thinking. But Market Research didnt have that impact on us",10,Not picked - have not opted in for this,9,All good - no issues at all,9,Career Prep is just doing a great job. no issues so far,10,Well Structured and executed.,6,"Not able to understand, why sometimes, there are mistakes like - shadi.com which completely deviates us as we actually thought this is a different entity and not shaadi.com. I do understand that the team is trying its best to get roles. but most roles have been a copy paste from linkedin( Lateral) and in general not getting responses",Vidhu Goel's sessions were amazing,none at the moment,3,9,Hostel Parties maybe,9,Nothing as such,10,Nothing as such,10,8,"Some mentors dont join the session wasting our time. I have always showed up in all my meetings on MentorUnion. Upon speaking to the mentors, they informed that there's no message which is shared to them about the session",10,Few roles nowadays are not being updated on career coach or not showing it to us.,8,had a decent time - hence this score,had a decent time - hence this score. Please change the sections again in term 4,"Stop Launching new programmes back to back. (eg. sports management, law , and other disciplines). When i spoke to UG students, they told me that Pratham's focus is on TETR or PGP. We as PGP also feel like his focus is on TETR and UG. Would suggest to give more focus to the current courses and make sure it just becomes the best"
TBM,10,6,8,8,4,9,,9,,7,,,,,9,"Market Research- Bhupesh Sir, Macro Economics Garima Ma'am",9,8,NA,5,"Did the Content Creation Challenge give you clarity on how to pick your niche, the right platform and type of content - No",5,"For the Head of Outclass, would you like to share any views, ideas or overall feedback?- No",7,"Has Career Prep made you feel more confident in terms of preparing for placements? If not, please guide what can we do better?- More mocks Gopika Ma'am is never responsive",5,"For the Head of Career Prep, would you like to share any views, ideas or overall feedback?- More IRM sessions",4,"For the Head of Career Services (Outreach), would you like to share any views, ideas or overall feedback?- Please reduce lateral jobs and bring more companies on campus. Also please have a transparent mechanism for jobs application and processes",Please mention the name(s) whose sessions you enjoyed the most and why it stood out for you.- NA,"For the Head of Master Relations (CXO team), would you like to mention any issues/ improvements?- NA",4,6,"In Term 3, what part of the student experience added the most value for you? *- Incas",4,"For the Head of Student Affairs, would you like to mention any issues/ improvements?- NA",9,Would you like to mention any issues/ improvements about Career Coach?- Good work,9,9,"No, keep up the good work",9,Would you like to mention any issues/ improvements about LMS (Coach)?- NA,6,Content was good - Term 4 seems more promising,What worked best for you this term that we should continue? - Delivery of courses,"If you’re sitting on Pratham’s chair, what's the one thing you’ll fix right away? And how will you do it? *- PLACEMENTS NQA"
TBM,7,,10,5,10,,10,10,,7,,0,,,0,Market Research - absolutely mind blowing on what all I can do now using MR. THankful for the ODC of Samsara as well,7,7,"Would love to have more sessions for subjects like Macroeco and less sessions of leadership lab. Was too much of storytelling. Would also love to have practical sessions of GenAI - teaching us how to make Ads, or automate workflows.",0,Did not do content creation challenge,0,Very irrelevant sessions happened. Would be extremely happy to get practical one on one help on branding. Multiple TAM SAM SOM sessions happened - repition of topics. THe low code no code session which happened for MVP was really good but very basic for us now. Need an advance vibe coding session. Whatevber is taught to us in inclass academics should not be taught in outclass.,0,Case prep should not stop. It gives your mind a structure. Term 1 was too early to have a case prep.,0,Need a lot of improvement in all aspects. Not at all happy.,0,Not answered,"Bhupesh sir, Pranav Dedhia - relevant things taight in class. I think they will come in use in real life. Financial Models were created in FM class. too good.",Bring small level cxo's who can really teach us how d2c works. dont want lectures on life. instead of making cxo sessions domain specific make them specific to what businesses students want to do.,10,10,No idea - nothing as such.,8,Improved and easy reimbursements,10,Not answered,10,10,Not answered,10,Not answered,7,2 subjects FM and MR,FM and MR - best things in the term,A better outclass experience. Outclass feels like you're all alone. Have no help from outclass. Feels like in class professors help you more than outclass team.
TBM,10,7,10,10,10,,10,7,,,10,,,,10,Dr Garima Macroeconomics,7,7,Not answered,9,I didn’t opt for content creation challenge,9,Not answered,9,I have improvised in terms of presentation in interviews after the feedback of gopika ma’am and implementing the feedback on real time basis. It has helped me,9,Not answered,8,I feel there should be a better screening in place for the companies as well,Dr Garima Pranav dedhia Shravn tickoo The sessions were well placed with examples and they were engaging too,Not answered,8,9,"Parliamentary visit, sports, and other events as well",9,Not answered,9,Not answered,9,10,Not answered,9,Not answered,8,"There is no single reason to this but a combination of many reasons. Like outclass, experience in academic sessions and ofcourse the parliamentary visit","What worked best this term was the strong emphasis on experiential learning, case discussions, real-world projects, and industry exposure made concepts practical rather than theoretical. The fast-paced environment pushed us to think and execute like operators rather than just students.","I would work on reducing fragmentation sometimes learning feels scattered across many activities. I’d create clearer connections between sessions, cases, and projects so students understand why they’re doing something, not just what they’re doing."
TBM,10,10,10,10,10,10,10,10,,10,,,,,10,"Ashank Bhandari and Rajat Mathur Dr Bhupesh, Dr Garima, Dr. Vipin",10,10,Queries took a little time to resolve plus there was so much class clashes at same time which was not there earlier while opting for courses,7,I did not opt for this course,7,Did not gain knowledge or experience as expected,10,"It helped, but kind of demotivated me with bad or unnecessary feedbacks like I am not good for a particular domain also felt a little discriminated by faculty during FGDs",6,"It is necessary for career prep to motivate us that we will be able to achieve our dream jobs rather than criticising it. Specifically for Gopika ma’am. Sorry to say this, but her session had a negative and demotivating impact",10,They are circulating good opportunities but we need more in campus opportunities,"There was one female who took session for MVP website building session, that was amazing as she taught us from step 1 till end.",No issued faced from my side fir this term,10,10,Hostel engagements and parties,10,"Delay in response, but eventually its resolved. Also Ritesh help me alot to get it resolved. It was his efforts alone.",8,Not able to visit next pages in career coach and I can’t pick up from where I left,10,10,There is a bit lag while scheduling calls,10,"Schedule changes alot, if we can minimise that",10,"Academic support for there, Students Affairs team specially Ritesh helped me alot with all the planing of events and resolving all the issues. We had great events this term and even the professors were amazing",Keep throwing some parties to keep a balance between social and academic life and to keep mental health in place.,Invite more campus placement so that my whole batch get placed asap by reaching out to companies and Brands door to door and sell my college there so that I get 100% placement
TBM,7,,6,,,10,,9,,6,,,,6,10,"Rajat sir, I think as new founder.. I needed few reality checks. Bhupesh Sir, he was amazing with students who are weak on math end",7,6,"Please plan the term in a way where all the pressure is not at the end. If few sessions can have exams/presentations before (for 5 class courses) last week of sem, it'll have more fruitful output. If we know all the subjects coming in the upcoming sems, we'll be able to decide wisely what all we want to study in a particular sem and what we can complete in next if missed.",8,"Did not choose, felt like added effort",7,"Pitch Practice sessions should happen often. Please put mandatory checkin time for the teams to have a connect with you. People have apprehensions reaching out to you irrespective of the fact that you feel why they did not come to you before pre seed coz they are not doing anything. A lot of us as clueless and scared. Need more mentoring. Also, Please help the people who are actually building get some slack in timetable and attendance in in class as well.",2,They have not! I'd request career prep team start actually understanding what are the actual skills of EACH student and then recommend suggestions.,4,I wish all the career policies set by college for placement is same for all the students.,5,Not answered,................................,Not answered,8,6,The events were good,7,Not answered,6,Not answered,6,6,Not answered,6,The new feature of QR scanning inside the ham is actually increasing the time to find and the scan. keep it upfront.,7,"I was made comfortable with numbers, with my startup idea but career prep was too much uncomfortable. Long hours CEP, no choice between brand and growth","Good assignments, very nice classes.Amazing faculties",Tell career prep team to understand what students are capable and see the diversity. Students require feedback on why not getting selected. and outclass team to make mandatory slots for teams to individually talk.
TBM,8,1,9,6,8,,8,8,6,,,,,,7,Pranav Dedhia had the most impact on me,6,5,Not answered,4,did not opt for content creation challenge,2,Not answered,8,"yes, career prep has helped me feel more confident",7,Not answered,2,Not answered,"enjoyed session with Nitin gadkari the most, very insightful",Not answered,3,6,events on campus added most value for me,6,Not answered,3,"many bugs, some opportunities were visible on mobile but not on desktop",7,8,Not answered,7,Not answered,6,academically expectations were not met as well as practical learning element felt lesser,hearing feeedback and vetting faculty,focus more on courses which are more practically focused
TBM,10,8,9,9,9,,10,9,,,,,,,10,Financial Modelling and Macroeconomics,8,8,Nothing to add,9,Nothing to add here as I did not partake,5,Nothing to add,8,I think the efforts from the career prep team are top drawer,9,Nothing to add,8,Nothing to add,Professor Garima returned after a couple of months and in the first class itself I remembered what a great faculty she is. She went out of her way to arrange a revision session for the cohort which I'm very grateful for.,Nothing to add,8,8,Nothing in particular to add here,8,Nothing to add,8,Nothing to add here,8,7,Nothing to add,8,There are still few errors/bugs which result in attendance records and grades not being reflected correctly.,9,Engaging electives and subject matter,Selection of quality faculty,"I think we could introduce one on one feedback and improvement sessions, the careers team can take up initiative to understand where and what went wrong during interview processes and then release resources or provide feedback as to what that student can do to align themselves with the roles that they want to apply for"
TBM,4,,10,10,10,10,,8,,,10,,,,10,Ashank Bandare for product 102,9,9,Nope,1,Did not participate in the challenge,0,For the pre seed pitch day we got a very young traditional person as a judge to evaluate my non traditional business idea the bottom line is a person who is younger than I'm can't be a person to judge they may have knowledge but here experience is what matters so my outclass experience was impacted a lot,8,Yes even created focus groups for me but no shortlists so far,8,Laterals are fine as long as people are getting placed but we need more roles and shortlists as well,8,Not answered,Ashank Bandare for product 102 was out of the park,Not answered,9,9,Nothing noticeable to differentiate last term and this,9,Not answered,9,It's not capturing real time data and backend should provide with such data,9,9,Not answered,9,Not answered,7,The main reason is masters union is not able to create the same IIM vibe mainly coz we don't have a campus and hostel attached to it still feels like I'm in a work place and plus the people that are hired are predominantly from Delhi NCR from High back grounds so there is a partiality wall always and entering into MU doesn't feel like spike how it is for an IIM or ISB because of these,There are no spikes I can think offf,"Stop marketing at scale which it's going and rather focus on results coz the notion in the public about MU is that ""you guys are marketing it too much"" for any great college marketing is done by results not by spot light and also please stop adding more and more courses and concentrate just on TBM,YLC and rise batch people it's too early to have these many sub branches without stabilizing the core pillars interms of placements and so on , should also develop more recurring companies for placements that visit MU"
TBM,9,5,8,,,,,10,10,,6,,,,10,Prof. Rajan Bhalla in BTB marketing as well as Prof. Rajat Mathur in Leadership Lab,9,9,"BTB marketing course was really helpful since it gave us more perspective on BTB businesses in general and very few courses are BTB specific. If possible, please try to have more BTB specific courses.",10,NA - didnt participate,7,"The sessions where we were pitching or getting feedback on our pitches was helpful, other theoretical sessions felt useless. Also, time management for all sessions should be improved massively. None of the sessions start or end on time and there is a lot of time wasted.",4,"Prep for data domain was sub-par. Only 4 practicum sessions were organized. While the sessions themselves were good, more content/syllabus could have been covered.",4,More ANMs and more focus on data as a domain as well would be good,3,"I have honestly lost hope in the placement process here. A lot of roles are lateral opportunities where no one is getting shortlisted. We dont even have visibility of whether our resumes are reaching the HR. Also, the ctc's have been below expectations.",Prof. Dalian Cane from Yale,NA,5,10,The academic courses,9,NA,7,"Some small bugs here and there such as being uneligible to apply for jobs for no reason, filters not working correctly, etc. - already raised with the product team",10,10,NA,10,NA,9,The in-class module was great with relevant subjects and great faculty,Great faculty and relevant subjects,The placements seem like a scam at the moment. More than 450 roles have been floated and roughly 20-30 students have been placed. Less no. of roles but more roles where they are seriously considering MU or even MBA students should be floated.
TBM,10,,10,,,10,,10,,9,10,,,,10,Ashank Bhandari's Product Management 102 was the best course for me that stood out.,10,10,"It was a massive improvement in terms of faculty teaching, content quality from term 2 to term 3. Hope it stays the same. Term 3 was very fruitful.",9,I did not take part in it.,8,Nothing much,7,"Yes, they have been helpful",9,Just keep on helping us whenever needed but I guess spoonfeeding will never be a good idea.,4,Please maintain transparency and prompt responses.,Gopika ma'am's sessions were good.,Not answered,9,7,Just being a part of all events,8,Nothing much,9,The UI/UX and the search index for jobs could be improved,8,9,It is ok for the time being,9,Nothing much,9,The subjects and the faculty teaching those respective subjects were of great quality,Great faculties who know how to teach,Be in touch with Career Services team
TBM,9,,10,6,10,10,,8,8,9,,,,,10,"Rajat Mathur, Sahil Puri and Garima ma'am's course was exceptional",9,9,Not answered,6,I didnt participate in this challenge,7,There is lack of help and guidance which is why students give up so fast,8,"Yes, loved the sessions by Vidhu",8,Not answered,8,Not answered,"Vidhu Goel, Gopika Ma'am",Not answered,9,9,Academics and student events,9,Not answered,9,Not answered,9,9,Not answered,9,Not answered,9,A much better experience is comparison to Term 2. Loved the faculty members and the ncourses,The courses and club led student events,The placement processes can be better handeled
TBM,9,,10,,,10,,10,,7,9,0,,,9,Shravan tickoo and Ashank bhandari were awesome! and they connected with students,8,8,"There should be someone to monitor TA/PA behaviour if we have concerns then whom we can raise, even if we write to academic ops then the reply comes in favour of them and no such body to raise them. Specially, TA Divya and Madhur lack basic empathy when talking to students, there is a way to talk to students and understand if they are having some genuine concerns for me the disrespecting behaviour by these two TA's reduces overall NPS. It was never about attendance or grades it is always about giving us sense of belonging and understanding our situation and reacting accordingly but always harsh way of talking and behaviour is not a way. Even divya used word ""jao jisko ja ke complain karna hai karo"" meant go and complain whoever you want. Hope my feedback will be taken in positive manner and these things will be improved. I don't have any personal enemity with anyone and wish everyone grows in whatever path they take. Thank you",7,Not opted for this challenge,8,There can be some good mentors brought in if possible and make sessions more engaging.,7,what I believe at this point of time if someone is more inclined towards placements then schedule and time allocation should be made in such a manner that students get more time for studying about career prep and placements and not focusing on assignments as these assignments for some subjects not all will not help in getting or cracking a job.,7,Try to map each student and get them prepared as much as possible for getting placed or getting pitch ready for getting any funding,7,Get more product roles to the campus as currently there are very few product roles coming and try to bring more companies for campus drives as there are few campus drives happening and more open roles posted on career coach which are not easy to crack as compared to campus drives,"Bhupesh sir, sharvan tickoo, ashank bhandari, garima, vipin sir",Try to bring CXO who are more industry relevant and looking to hire from campus,8,10,"coming to campus and faculties talking us in such a manner(friendly and polite/being accessible) which gives me a sense of belonging that I belong to this place adds most value to me, even small gestures adds most value to it",8,Try to be more polite and accessible towards students and have empathy towards students understand if they are having some genuine concerns,6,career coach still have so many bugs which needs to fixed,9,9,platform is really very helpful,8,there is lot of scope for improvement on mobile app and website and bugs need to be fixed,8,academic experience was good but more job opportunities need to be bring in specifically product roles,some good masters brought like sharvan and ashank who helped me gain more interest and knowledge in product,"First of all behaviour of TA's specifically Divya and Madhur by talking to them and making them understand every human deserves basic empathy and respect and Secondly, students who are inclined towards placement bring some more job opportunities and legacy companies and I understand team is working hard on this but this should be taken more diligently because many of us are having education loan and in societies we live in we have pressure of getting jobs and settle up or getting married. So please take this into consideration and for me whole goal for coming to MU was career transition into product management coming from software testing background but can't see many product roles coming helping me getting placed into a good product will suffice the goal coming to MU."
