TBM,10,,9,10,9,10,,9,,7,8,,,6,8,"1) Product Management 102- Ashank Bhandari Different aura- one of the best MU has brought to campus. 2) Product Analytics- Shravan Tickoo Beautiful insights, great delivery.",7,9,"Term 3 was better than term 2, but term 2 was really bad to keep that as a benchmark. Also- personally feel that feedback should be taken well, especially when it's really bad.",4,Did not opt for this.,3,"It feels like Outclass- one of the biggest USPs of MU is also the weakest point it has. The sessions are so pathetic, none of the speakers really know what they are there for. There is no sync between the Outclass team classes, students and expectations. For example- why are we still learning about TAM, SAM, SOM 6 months into our MBA course? People are purely attending these sessions for attendance- nothing else. What's the point?",9,"For sure. Career prep has been very very approachable at all times. You can reach out to them whenever you want and they will get back instantly. Apart from this, getting Prabhu for growth has been a gamechanger. People were ready to attend his sessions on a Sunday- guess that speaks a lot!",9,Great work!,1,"Sharing the overall sentiment of the batch: they have fully lost trust & faith. Why are so many people prepared to look for opportunities on their own suddenly? Here are a few things: 1) Linkedin opportunities are not actual options. At this point, it feels like they are just being posted to bring up the numbers of the placements being brought with no concrete result. Quality over quantity guys, that is as basic as it gets for your students' careers. 2) There is literally no freaking response about the placements. So many people are applying for SO many ""opportunities""- but they are just being kept in the dark. 0 updates. It is pathetic. 3) At the careers townhall- all the blame was very very smartly put on the cohort. That we are messing up, we are not applying and more crap like that. There was zero accountability from the careers prep team. It is quite convenient to blame the other party. 4) There is immense partiality and the entire batch is feeling it- through and through. There is NO transparency. This is definitely not going to look good on the trust factor. 5) Before the last date of the NPS submission- a mail was floated very conveniently again by the prep team. Felt like a therapy session. No onus yet again. To add on- the previous cohorts NPS scores were shared. Sorry to say but that is by far the dumbest thing I have seen. If you have the data, if you know where it gets bad- isn't that exactly how/when/where you improve? Just because it is expected, you will not do anything? The truth of the matter is, nobody here wants to figure out the root problems. 6) Why are more campus drives not happening? At this point, you need a placement season. It cannot be rolling placement process- it is not working out. Do NOT come and pin this on the quality of the cohort now. It is not on us.","Prabhu- for Growth/Marketing Super amazing, industry relevant, also very useful in terms of job interviews POV. He also kept away all personal boundaries- gave us all his free time, whenever. Super approachable, very passionate.",Thanks for removing the mandatory sessions! Maybe we can have more fireside chats with bigger/more relevant names,8,9,"The marketing club conducted a series of session that was like a career enhancement practicum in itself, very good initiative. Nothing from the management side.",1,Show up. Nobody knows that you are still around or working. You made such a big impact when you entered- almost like a saviour. And nothing after that. Ishant is working more than all of you guys combined- and one of the few guys who actually talks sense. For CNO/Pratham: 1) This team needs to hire better people. Please understand- this is the team that has the most amount of direct contact with the students. Especially the club presidents. The current interaction is with people who have no experience or knowledge of hosting experiences/events/in general workex seems quite irrelevant. It is a huge friction- makes me lost my faith in MU. 2) Please take a feedback from the batch about this. Let them take names. There are some people who are not working and the ones who are working (like Ishant mentioned above)- I dont think there is enough recognition. PLEASE- this team really needs a lot of work.,6,"""Open in new window"" option needed",8,8,Not answered,6,Should have been an app friendly platform instead of website,8,"Probably benchmarking how bad term 2 was, in comparison, term 3 has been great And academics have been really good in term 3",#NAME?,"The cohort needs more face time with Pratham. We have heard from all the previous batches how they used to sit with Pratham every day and that was exactly the mindset we came in with. While we understand that MU is growing exponentially and every day is not possible anymore, there are certain ways to feel like Pratham still cares about us/PGP TBM- at the moment the entire cohort feels neglected by every single department except acads. 1) A townhall with just Pratham and the CNO every term. Start/end- does not matter. We want to be sitting across the person who can actually make a change. This should be well structured, not just a ranting session perhaps- but trust is needed to be built and it is needed from both the sides. 2) PRATHAM NEEDS TO TEACH A COURSE. Can be an elective or a core course- but we WANT to learn from the man who built it all. This is the real zero to one experience. This can also be a masterclass every month or two months. But all of us are super keen on hearing his experiences- and in my opinion, there is nothing bigger than this for building a relationship."
TBM,10,,10,10,10,,10,10,,,,,10,,10,Python and AI for business,8,8,No,8,This was earlier planned to start during later term. Starting it now has made me to opt out from this since I am busy building my startup,8,No,9,Yes they have helped me to feel more confident,8,No,8,No,I don't think so there is any one who stood out,No,8,8,Don't think so there was any thing as such,8,No,8,"Yes, please check your official email id regularly. I had raised something 2 months back which is still pending",8,8,No,8,"Yes, check your official email id regularly. I had sent an email with discrepancies 2 months back which is still pending at your end",8,Got to learn something different which i never learned in past,More of odc like assignment,Enhance trust on how Mu is really working hard for the students whether it be academics or placement
TBM,8,,9,7,8,8,,10,,8,,,,,10,Rajat Sir’s class was excellent along with the stories. Bhupesh Sir’s course was probably the most important course I have learnt this term and like he said no one in the country can teach this better than him Vipin Sir’s course was great with each day emphasising on cases and breaking them down,10,9,Sometimes classes are updated 1 day before would really appreciate if they are updated in advance like most of the classes are,7,Didn’t opt for the content creator challenge,7,The shortlisting should give priority to those who actually are interested in VIP vs those who are focusing only on placements,9,"Yes , the sessions that were conducted daily at night focusing on case prep were really helpful in building a base",9,Not answered,5,"Need more clarity on upcoming companies except from the lateral ones, more campus drives or campus hiring companies","Bhupesh Sir’s sessions as understanding the aspects of market research are most relevant for industry knowledge , it helped summarise various other courses as well.",Not answered,10,9,"Peer to peer learning , courses which I have mentioned",10,Not answered,8,There are sometimes few bugs due to which viewing the schedule or other things becomes difficult,9,9,Not answered,8,Just fixing the bugs would be good enough,9,All courses in term 3 were pretty good and from the learning pov also all the courses felt really important. Even the faculty was good for all the courses this term. Significant improvement from term 2,Bringing in the faculty that don’t just have great knowledge but also can explain or teach well,More campus placements Regular check on placements team for bringing in campus drives and if s company says no - understanding the reasoning behind it and try to focus more in that area.
TBM,9,,10,3,10,,9,10,,8,,,,,9,"I think Rajat mathur, I would never forget his classes. Very interactive",10,8,Na,10,The sessions were not very insightful honestly but talking to the outclass team personally would help,9,Not answered,2,I dont feel so Its the same as term 2,3,Not answered,8,Not answered,I think negotiations session was really good,Not answered,8,9,I think vip challenge and sports events,8,Not answered,9,Not answered,8,9,Not answered,9,Not answered,9,I think my peers who help me study,Bhupesh sirs classes always,I think being more personalised and motivating childern more to start their business. Giving a push
TBM,9,,7,,,,10,10,,,,,9,,10,Mr. Rajat Mathur's Leadership lab had the most impact on my personal growth and Financial modelling was very hands on,9,9,"No Feedback, liked term 3, it was way better than other terms",8,"I did not opt for CCC, no reviews.",9,"More Factory visits, for hands on learning",8,"Yes, Little nudges every now and then kept me on track",8,Not answered,4,Not answered,"Mr. Rajat Mathur, Bhupesh Sir and Pranav Dedhia, Very hands on and practical.",Not answered,9,10,Case Union was a great event,9,Not answered,9,Not answered,10,9,Not answered,9,Not answered,9,Improvement in terms of overall management,"Structuring, in terms of classes",Make a proper library
TBM,8,,8,9,8,,9,8,7,,,,,7,6,dr vipin - corporate stratergy,9,6,"Please set some basic rules in class. Eg : class Gate locks after 5 mins, CP marks should have a set of rules and not vague. Improve session summary form",6,did not opt in...............................,6,Not answered,7,everything was fineeeeeeeeeee,6,Not answered,2,Please share real jobs.,"not clear which session (cxo, in class, outclass, career preps, etc)","need better orators. not just during the time of next batch admissions, but in general. loved the coffee with idea",1,4,i was home for the most of time.......!,2,Not answered,4,Not answered,5,7,Not answered,5,Not answered,5,can do alot better.........................,atleast trrying to improve,Communications of internal teams
TBM,10,10,10,10,10,,10,10,,,,,,,10,"Financial modeling has proven to be a highly impactful discipline. Its ability to forecast future financial outcomes is invaluable for strategic decision-making. Businesses can leverage financial modeling to assess investment opportunities and manage risk effectively. This analytical approach provides a structured framework for understanding complex financial scenarios. Ultimately, financial modeling empowers organizations to navigate the economic landscape with greater confidence and precision.",10,10,None,10,I did not apply for content creation challenge,10,None,10,Yes career prep has been taking active measure for this,10,The career prep has been very helpful,10,Not answered,I loved the leadership lab sessions also with financial modeling sessions,Not answered,10,10,I think the career services picked up which gave a morale boost to the batch. The engagement with pratham as well increased quite a bit which helped us connect with him.,10,Not answered,10,Coach lms is crashes everytime a decent volume of people try to access it. Whenever we have a test on lms it has always crashed.,10,10,Not answered,10,Not answered,10,"There are multiple reasons. The engagement, the academic help and careers team",I think the engagement. I felt there were people to reach out to. In most cases we have no clue whom to reach out to for most of our problems.,"Getting in SOPs for multiple processes. For the kind of organization Masters union is, the Sops are very limited."
TBM,4,,8,8,8,,,6,,,,,,,9,Dr. Vipin’s corporate strategy,6,6,Couple of subjects did not sit well. Macroeconomics was very basic. The concepts taught to us in class were something that we already covered at a school level. We were expecting more depth from the subject. Market research seemed to be an over-hyped course. Very marketing and research oriented. Could have been an elective.,7,Did not take part in content creation challenge,7,Not answered,8,"The placement prep has been fine, awaiting for companies and shortlists.",8,Not answered,8,Not answered,Please don’t keep minimum characters for responses. Sometimes the response is just NA,Not answered,6,7,Couple of pointers were discussed with Mr. Anand Sinha in term 2 to improve the student experience specifically from club’s perspective however they are yet to be actioned upon. The overall experience has been the same. No value added.,7,Not answered,9,Not answered,9,9,Not answered,9,Not answered,7,It’s a simple average of all the ratings given in previous questions,The VC practicum was helpful. And also mentor union for interview preps,Transparency at placements is something we are looking for. We either do not get our desired firms or roles to apply at or if we do we aren’t receiving a shortlist despite our profiles being in line to what was asked for. This gap needs to be understood and bridged between the placement team and employers.
TBM,10,5,9,7,8,10,,8,,,,,10,7,10,Rajat Mathur Sir had the most impact. His way of teaching by taking real life examples along with his delivery was on point.,7,8,"the assignments could be scheduled better. For us, the leadership lab was conducted during the final 10 days of the term along with the end terms and assignments which was also a bummer.",6,I opted out of the content creator challenge.,7,Nothing really.,6,Not really. May be there could be more 1 on 1 sessions or a smaller group of students from a single domain so that we can learn from each other better.,5,-,5,"Please try to bring roles from legacy organization. Also, feedback on interviews which were unsuccessful would be helpful.",Leadership Lab - All the session in fact. Our professor taught us the fundamentals using real life examples and the classes were very engaging.,-,6,7,"This term, we had better academic subjects than last term.",8,-,7,-,7,8,-,8,-,8,Better subjects and faculty,The faculty and the subjects,Bringing more roles from legacy organizations may be
TBM,7,,9,9,9,10,,10,9,,,6,,,9,Product Management ( Ashish ),8,8,Term 3 was good for me. I was aligned with all the core courses and electives.,7,I didn't opt for content creation challenge.,6,I've written this in most of the feedback forms. I was disappointed with the coordination part. The classes don't start on time due to proper coordination and please make the students sit with their respective groups so that they can brainstorm together. The faculties that are brought have to be more experienced as i felt.,7,"I really loved personalised feedback on my resume and linkedin. Riti did a good job in that. Would also request if we can get some more experienced folks in the team. I honestly felt the feedback that i was getting was more generic. It is good for a person with 1-2 yrs of experience but not for someone who has been in the industry for long. This was my only part, apart from that remaining all was good.",7,I've already given my feedback on the career prep. Would also request if we can get some more experienced folks in the team. I honestly felt the feedback that i was getting was more generic. It is good for a person with 1-2 yrs of experience but not for someone who has been in the industry for long.,8,Everyone in the career services team is cooperative and extremely helpful. They go out of their way to solve our problem.,"If i've to say from the career services team, Akash was extremely helpful along with Adiksha and ajaya. Remaining all as well were very helpful.",Term 3 cxo's were good. I enjoyed it.,6,9,It was good and i didn't face any problem.,9,NA. Awesome experience,8,Nothing as of now.,6,6,"The feedback that we give to the mentor post our MentorUnion call should be anonymous. It's actually visible to the mentor. I had one of the mentor's messaging me on linkedin, can you change the feedback from 4 to 5.",8,NA,9,I have worked on myself a lot on term 3 so can see the improvements.,I think more options on the electives should be given.,"Hats off to pratham. He is doing such a great job but since this question is asked, I would request Pratham to schedule more townhalls atleast once in 3 weeks or a month and talk to the cohort. So, that we are aligned on wants and needs per month."
TBM,7,8,9,,,10,,10,,6,7,,,,10,"Ashank Bhandari has the most impact, the way he taught the PM class was really good.",6,6,Not answered,6,Have not taken a part in this,6,Not answered,5,Have been getting guidance from mentors on Mentor Union,5,Not answered,6,Not answered,Ashank Bhandari - PM. I enjoyed his classes the most in term 3 and then Rajat Mathur's classes.,Not answered,5,6,To work as a team on different projects,5,Not answered,6,Not answered,6,5,Not answered,6,Not answered,6,I think I have described it section wise and it's cumulative of all those factors.,2 things: A) Bring more teachers like Ashank sir to teach us. B) Bring more relevant career opportunities.,I will ask how can I ensure that all of these students are learning what's being taught and ask the students to come up in groups/individually to discuss their pain points.
TBM,6,,8,8,7,,,6,8,,,,,,9,Rajat Mathur's class gave the most worldview picture of how to go about in life.,5,6,NA,5,NA didn't opt in for this,6,Probably put more emphasis on people who want to only build the business.,5,Not give different views from different people. Didn't receive much guidance over what i already knew. Get feedback when not shortlisted,5,Already shared previously,4,"Please not to share the steps on which a student is in until they get the job or is on final stage. Don't share all steps with everyone. Also, if someone is sending a job they have applied for externally would be great if more work can be made to push those roles.","Rajat Mathur, Rajan Bhalla",More CXOs related to marketing domain please,6,7,The MU's got talent was good,6,Yes more activities please. And better organization when an event is there,5,Was not getting notification for a new job opening,7,7,Not answered,6,Not answered,6,Would appreciate we could get to study the subjects more instead of immediately getting placed. The idea of people getting placed is causing pressure for the ones wanting to study more. and then take a job.,Practical knowledge + theory,Make it feel more like a college maybe. We already don't have a proper campus and have different hostels. Unity is not there because of the same. No peer to peer learning and disconnect
TBM,1,,4,,,10,,5,,4,,,,,9,"Ashank bhandari, loved his classes and way of teaching.",7,6,Not answered,10,didn't opt for cc challenge,10,"for people building in tech it would be really helpful if we can gen industry help in terms of verified freelancers or agencies or fractional CTOs who can help build out the product once the no code prototype has got traction. this specific for later stages. pre seed everything was smooth, just the number of assignments were on the higher side.",9,vc practimuns were really great. the faculty was very helpful,8,Not answered,4,don't bring in any and every opening you get from linkedin but try to get a sense of companies who would hire from a college gaven the batch profile.,"Ashank bhandari, loved his classes and way of teaching.",Not answered,7,8,outclass and belong club,5,Not answered,6,Not answered,8,10,Not answered,7,Not answered,7,outclass and Ashank bhandari' classes,outclss focus and individual prep guide,i would build long term industry connects with companies so that there are more campus drives and there is a 2 way relation. currently it's a one way relation where companies have the upper hand and they control the placement process and can do whatever they what without any consequences.
TBM,10,,2,8,4,10,7,2,,7,,,,,10,"Rajat Mathur's lecture left a very deep impact on me. His diction, his style of delivery, and the stories as well as experiences, as well as the activities he brings in the class, are above and beyond the world. Probably the most excited for any lecture to wake up in the morning and show up. And truly, truly great lecture. Ashank Bhandari’s lectures were excellent. He came extremely prepared and had deep command over his content. His delivery and the overall classroom experience were genuinely outstanding. He made product management feel very human and relatable, and there was never a dull moment in his class. He was not what some people loosely label as an “entertainer,” a term often used by the ""heads"" to suggest that we students only enjoy surface-level engagement. Yet, every minute of his lecture was enjoyable because of the sheer value it delivered. It was rigorous, thoughtful, and meaningful, which made the learning experience far more rewarding than mere entertainment. Dr. Garima’s lectures were truly excellent. I enjoyed each and every moment in her class. She made macroeconomics fun, engaging, and highly interactive, and I genuinely looked forward to every lecture she taught. What I appreciated the most was her humility and openness to learning. If there was ever a gap in understanding or a topic she wanted to explore further, she was comfortable asking questions herself and learning alongside us. She always met us at our level first, understood our perspective, and then lifted the entire class together. An amazing professor in every sense.",8,7,"There should probably be fewer RIDE sessions and more focused lectures, as students would likely benefit more from that balance. If certain professors cannot manage multiple roles effectively, it might be better for them to stick to what they do best, which is teaching. When that balance is not maintained, lectures often drift away from learning and turn into extended sessions of disappointment, criticism, and commentary on how poor the batch supposedly is. While I understand that this may come from a place of concern, repeatedly spending a significant portion of lectures berating students does far more harm than good and ends up demotivating everyone. Over time, it begins to feel less like guidance and more like an attempt to shame or scare students into performing, which rarely works. In this term, some lectures, particularly in market research, felt disengaging and unfocused, with more time spent highlighting our shortcomings than actually teaching the subject. It even appeared as though the instructor himself was uninterested or burdened by the class. Additionally, it was already known that several students were struggling with statistics, yet no revision or bridge sessions were conducted despite long breaks during the term. While peer-to-peer learning has its place, it fails when an entire cohort is weak and only a handful are confident. In such cases, everyone stagnates. What was missing throughout was compassion and structured academic support, and that absence affected the entire batch.",5,Did not participate in the content creation challenge,5,No particular feedback,7,"The CareerPrep team has been doing a solid job throughout. They have been consistently following up and pushing us to get things done, which is honestly necessary at times. Their interactions are structured and reassuring, and they help build confidence rather than anxiety. Overall, engaging with the career team has been a positive experience",7,Not answered,8,Not answered,"Lectures conducted by Mr. Prabhu were excellent. I am not from a marketing or growth background, but I happened to attend one of his classes. His diction was sharp, his command over the content was evident, and he had strong control over the classroom. What stood out most was his patience, even when faced with poorly framed questions. At the same time, he knew when to steer the discussion back on track, which is essential in areas like customer engagement and growth. Despite my limited background, I was able to absorb only about 20–30 percent of the material, but even that made the experience thoroughly worthwhile. It was genuinely impressive.",Not answered,7,3,The events conducted by the clubs were nice. Even the sports events conducted here and there were nice.,7,Not answered,7,Not answered,7,7,Not answered,7,Not answered,6,"Overall, it was a fine experience. Nothing out of the ordinary, and nothing particularly bad either. That sums it up well.","The roster of professors this term was quite strong. It felt like the faculty was better vetted compared to the previous term, both in terms of content and teaching ability. The professors seemed more in control, and the lectures were noticeably more engaging. That said, there were one or two sessions of some professors that felt less like learning experiences and more like shaming exercises, which took away from the overall academic value.","If I were sitting in Pratham’s chair, the first thing I would fix is how classroom time is used. I would clearly separate learning-focused lectures from feedback or alignment sessions. Lectures should remain dedicated to teaching and skill-building, while concerns around discipline, effort, or expectations should be addressed separately. These feedback sessions should be conducted in smaller, closed groups rather than large auditoriums. In small groups, students are more likely to open up and share honest feedback. The insights from these sessions can then be synthesized at a cohort level for action. This format would lead to clearer communication, higher accountability, and a more constructive academic environment without compromising classroom learning."
